COMPANY,FSC_CODE,COUNTRY,CONTINENT,ADDRESS,CONT_PER,TELEPHONE,FAX,EMAIL,WEBSITE,ISSUDATE,EXPDATE,PRODUCTS
OR-DOM Spolka Jawna Dominika,SGS-COC-1145,Poland,Europe,"96 Kaliska St., 62-700 Turek",Mr. Jan Mechlinski,48 63 278 5304,48 63 278 5304,,,27.09.02,27.09.07,production and export of garden wooden products ans sawmill products
"Fabryka ""Sklejka Pisz"" S.A.",SGS-COC-1146,Poland,Europe,"19 Klementowskiego St., 12-200 Pisz",Mr. Tadeusz Banach,48 87 423 5200,48 87 423 5140,,,27.09.02,27.09.07,"Production and export of hard and soft wood plywood, transformer plywood, overlay plywood, compreg, compreg plywood and curved plywood"
ZPPD LUBTAR S.A,SGS-COC-1177,Poland,Europe,"7 E. Plater St., Zielona Gora",Mr. Michal Skalski,48 68 324 3380,48 68 320 4700,,,25.10.02,25.10.07,"production ans export of hard wood sawn timber, stripes, furniture elements and sawmill co-products"
RELAX Jaroslaw i Marek Lapyr Spolka Jawna,SGS-COC-1187,Poland,Europe,"41 Klonowo, 13-230 Lidzbark Welski,",Mr. Marek Lapyr,48 23 696 1522,48 23 696 3148,,,25.10.02,25.10.07,production and export of garden wooden products
Przedsiebiorstwo Produkcyjno Handlowe Export-Import Danuta i Boguslaw Bodnar DREW-TRANS Spolka Jawna,SGS-COC-1292,Poland,Europe,Wolcza Mala 4 77-200 Miastko Poland,Mr. Boguslaw Bodnar,+ 48 59 857 3842,+ 48 59 857 3842,,,31.01.03,31.01.08,"production and export of sawn timber, stripes, wooden mosaic floor, railway sleepers, window rule and sawmill co-products"
Unidrew Sp.z.o.o,SGS-COC-1203,Poland,Europe,"3 Stadionowa St., 19-500 Goldap",Mr. Jacek Szmyga,48 87 615 0920,48 87 615 0527,,,25.10.02,25.10.07,"production and export of sawmill products, garden wooden products, planed wooden products, elements of pallets, constructional elements of house and sawmill co-products."
Spoldzielcze Zaklady Uslugowo-Wytworcze K. R. ROLMECH,SGS-COC-1207,Poland,Europe,"Traugutta 5, 88-220 Osieciny",Mr. Stanislaw Byczek,48 54 265 0058,48 54 285 2416,,,22.11.02,22.11.07,production and export of garden wooden products and sawmill co-products
Tartak Sulechów sp.z o.o.,SW-COC-829,Poland,Europe,"ul. Bankowa 2, Sulechów 66-100",Mr. Andrzej Str czy ski,+ 46 68 385 0020,+ 48 68 385 09 74,tartak@tartaksulechow.com.pl ,www.tartaksulechow.com.pl,15.12.02,14.12.07,"furniture-outdoor /garden, Lumber (green), Lumber (kiln-dried)"
Zaklad Produkcyjno Handlowy Stefan Bulka,SW-COC-828,Poland,Europe,34-385 Rycerka Górna 237 A,Mr. Stefan Bu ka,+ 48 33 864 4210,+ 48 33 864 4210,,,01.12.02,30.11.07,boards (glue boards for stairs)
DAN-POL Marianna Potapczyk,SW-COC-822,Poland,Europe,"Kozia Góra 11 c, 78-230 Karlino",Mr. Henrik H. Jensen,+ 48 943117377,+ 48 943116245,danpol@ekodorinfo.pl ,,01.12.02,01.12.07,Spliced veneer
P.P.H. EKO-DREW s.j. M. Koniuszek St. Rozpedowski,SGS-COC-1229,Poland,Europe,"Zebieniec k/Wloclawka, 87-704 Badkowo",Mr. Marek Koniuszek,+ 48 54 27 24633,+ 48 54 27 24377,,,05.12.02,05.12.07,garden wooden products
HOL-POL Sp. z.o.o.,SGS-COC-1257,Poland,Europe,"49-135 Przechod 35,",Mr. Andrzej Bujok,+ 48 77 431 3367,+ 48 77 431 3367,,,27.12.02,27.12.07,production and export of sawmill products and sawmill co-products
"Suwalskie Przedsiebiorstwo Produkcyjno-Handlowe ""WITAL""",SGS-COC-1273,Poland,Europe,"Kolonkiewicz, Uzdzilo Spolka Jawna 9 Modrzewiowa St., 16-400 Suwalki",Mr. Jerzy Uzdzilo,+ 48 87 565 6452,+ 48 87 565 6454,,,24.01.03,24.01.08,"production and export of sawn timber, elements of garden wooden products and sawmill co-products"
PW Trakart,SGS-COC-1149,Poland,Europe,"30/109 Promorska St., 66-400 Gorzow Wllkp",Mr. Marek Pietraszkiewicz,48 68 341 14 941,48 68 341 14 942,,,27.09.02,27.09.07,production and export of garden wooden products
Przedsiebiorstwo-Produkcyjno-Budowlane“ZETBEER” Sp. z o.o.,SGS-COC-1511,Poland,Europe,"Orzeszkowo 29, 64-420 Kwilcz",Mr. Tomasz Sobieraj,+48 61 291 50 21,+48 61 291 52 48,,,17.09.03,16.09.08,"Sawn timber, garden wooden products"
PPHU Eurex Janusz i Danuta Kedzia sp.j.,SW-COC-956,Poland,Europe,"Godynice 22B Godynice, 98-277",Janusz Kedzia,48.438.211.563,48.438.211.673,eurex@eurex.pl ,www.eurex.pl,01.06.03,31.05.08,Furniture - outdoor / garden Garden supplies Pallets Shelving Sawdust Lumber Boxes for transport
"ZPHU ""Quercus"" Mariusz Stachowicz",SW-COC-979,Poland,Europe,"ul. Warminska 4/1 Jedwabno, 12-122",Mr. Mariusz Stachowicz,48896213168,stachowicz_quercus@pf.pl ,,,15.07.03,14.07.08,Chips Chips for production of chipboards and burning 70000
Zaklad Drzewny Napiwoda sp. z o.o.,SW-COC-980,Poland,Europe,"13-104 Napiwoda 19 Napiwoda, 13-104",Mr. Edward Darmofal,48896259061,zdn19@o2.pl ,,,01.08.03,31.07.08,Lumber (kiln-dried) 7000 Sawdust 3000 Lumber (green) 10000 Bark and mulch Panels 1000 Chips 2000 Construction wood 2000
Grupa Krameko,SW-COC-990,Poland,Europe,"ul. Mazowiecka 108 Kraków, 30-023",Mr. Wojciech Romanczyk,48122945222,48122945223,certyfikacja@krameko.com.pl ,www.krameko.com.pl,01.08.03,31.07.08,Flooring 7000 Lumber (kiln-dried) 10000 Lumber (green) 10000 Panels 5000 Construction wood 10000
Hardex Spolka Akcyjna,SGS-COC-1066,Poland,Europe,63 Gubinska St. 66- 600 Krosno Odrz,Mr. Waldemar Motyka,+ 48 68 383 5301,+ 48 68 383 6211,,30.05.02,30.05.07,fibre boards and varnished fibre boards,
Zaklad Produkcji Drzewnej,SGS-COC-1477,Poland,Europe,"1 Wolczynska St., 46-034 Pokoj,",Mr. Zbigniew Olszewski – owner,48 77 469 30 29,48 77 427 10 41,,02.09.03,01.09.08,Sawmill products,
Stolarstwo Ryszard Ossowski,SGS-COC-0588,Poland,Europe,"6 Chojnicka St, 89-650 Czersk",Ryszard Ossowski,48523984266,48523984189,,22.12.00,21.12.05,Production and export of furniture and furniture fronts from sawn timber covered by the QUALIFOR,
DSR DARIUSZ RABUS,SGS-COC-1480,Poland,Europe,"2 Jaspisowa Str., 71-237 Szczecin Zaklad Produkcyjny 19 Drawska Str., 78-540 Kalisz Pomorski",Mr. Dariusz Rabus,48 94 361 64 99,48 94 361 64 99,,26.08.03,25.08.08,Sawn timber/brush handles,
POLWOOD Spolka z o.o. Tartak Krzywin,SGS-COC-1482,Poland,Europe,"56 Drzewiarzy Str. , 74-121 Krzywin",Mr. Dariusz Gunia,48 91 416 75 76,48 91 416 75 76,,02.09.03,01.09.08,Sawn timber,
EASTWOOD sp. z o.o.,SW-COC-992,Poland,Europe,Czyze 199 17-207 Czyze,Mr. Bazyl Dabrowski,"+48856813477, +48604182235","+48856813477, +48856843940",bazdab@poczta.fm ,,01.08.03,31.07.08,"Boxes Boxes with drawers from plywood, boxes from solid 80"
BARLINEK S.A.,SGS-COC-1258,Poland,Europe,,Fax: ,,25.12.02,26.12.07,,,,
Przedsiebiorstwo Wyrobow z Drewna “PALISADA”,SGS-COC-1462,Poland,Europe,"20 Dworcowa Str., 46-025 Jelowa,",Mrs. Zofia Albert,+ 48 77 42 11 026,+ 48 77 42 11 026,,05.08.03,04.08.08,"Palisades, roll-borders and sawn timber",
“DREMI” Sp. z o.o.,SGS-COC-1512,Poland,Europe,"20 Poznanska Str., 66-300 Miedzyrzecz",Mr. Jaroslaw Logdanski,+48 95 741 17 54,+48 95 741 18 28,,18.09.03,17.09.08,"Sawn timber, pallets",
Zaklad Stolarski „Jodla”,SGS-COC-1518,Poland,Europe,"19 Serwis, 26-006 Nowa Slupia",Mr. Marian Mocon,48 41 317 70 51,+ 48 41 317 85 31,,30.09.03,29.09.08,Wall-paper pasting tables,
Przedsiebiorstwo „Almax” Lidia i Andrzej Skalscy,SGS-COC-1519,Poland,Europe,"Bytonia, 19a Glowna St., 83-210 Zblewo,",Mr. Andrzej Skalski,+ 48 58 560 90 41,+ 48 58 560 90 42,,30.09.03,29.09.08,Garden wooden products,
PPHU CARTEM sp. z o.o.,SW-COC-1027,Poland,Europe,"ul. Rolnicza 41 Wodzislaw, 28-330",Aleksandra Migalska,48413806057,SW-COC-1027,,15.09.03,14.09.08,Brushes 2000000,
POOLWOOD sp. z. o. o.,SW-COC-1046,Poland,Europe,"Zaklad Produkcji Drzewnej Ogonki Wegorzewo, 11-600",Mr. Adam Biedrzycki,48874272774,48874272621,biuro@poolwood.pl ,,01.10.03,30.09.08,Fencing 1000 Flooring 2000 Furniture - outdoor / garden Lumber (softwood) 10000 Sawdust Chips
Ramex Sp. z o.o,SGS-COC-1526,Poland,Europe,19-403 Szczecinki 46,Mr. Jan Sokolowski,+ 48 87 520 67 97,+48 87 520 67 88,,10.10.03,09.10.08,Garden wooden products,
Przedsiebiorstwo Handlowo-Uslugowe “PALDI” Sp. z o.o.,SGS-COC-1528,Poland,Europe,"18/C Jaski, 19-400 Olecko,",Mr. Boguslaw Brzostowski,+48 87 520 08 00,+48 87 520 0823,,10.10.03,09.10.08,Broker activity,
“Womi” Sp. z o.o.,SGS-COC-1529,Poland,Europe,"3 Skladowa St., 11-510 Wydminy,",Mr. Lech Milewski,+ 48 87 420 99 00,+ 48 87 420 99 01,,10.10.03,09.10.08,Garden wooden products,
Przedsiebiorstwo Produkcyjno-Handlowo-Uslugowe „Limba”,SGS-COC-1530,Poland,Europe,"Kukowo, 19-400 Olecko",Mr. Tomasz Szarel,+ 48 87 523 01 72,,10.10.03,09.10.08,Garden wooden products,,
Doltar - Budekor Sp. z o.o.,SGS-COC-1490,Poland,Europe,"11 Komorowice St., 52-211 Wroclaw",Mr. Bogdan Malesa,48 71 316 41 90,48 71 316 41 92,,02.09.03,01.09.08,Wooden houses,
CENTRUM DYSTRYBUCJI i OBROBKI DREWNA Sp. z o.o.,SGS-COC-1428,Poland,Europe,"29A Mrongowiusza St, 11-700 Mragowo",Ms. Beata Chojnowska,+48 89 622 60 74,+48 89 741 85 26,,23.06.03,22.06.08,Sawn timber,
POLTAREN Sp. z o.o.,SGS-COC-1363,Poland,Europe,"Bemowizna 26, 14-500 Braniewo",Mr. Marek Laszkiewicz,48 55 244 23 00,48 55 244 24 00,,11.04.03,11.04.08,"Sawn timber, stripes, pallets and elements of garden wooden products.",
P.P.D. Petrykozy sp.j.,SW-COC-922,Poland,Europe,"Skronina 260, 26-307 Bialaczów",Andrzej Górski,48 44 758 27 94,48 44 758 27 85,tartak.petrykozy@wp.pl ,www.petrykozy.prv.pl,15.04.03,14.04.08,Flooring Lumber (kiln-dried) Pallets Paneling Sawdust Lumber (green
Refas sp. z o.o.,SW-COC-915,Poland,Europe,"Fabryczna 10, 34-730 Mszana Dolna",Iwona Szereszewska,48-18-33-10-023,48-18-33-11-713,refas@ceti.com.pl ,,15.04.03,14.04.08,Components Funriture Components 150
"Tartak Kazimierz Ustaszewski, Jadwiga Ustaszewska sp.j.",SW-COC-924,Poland,Europe,"Cendrowizna 2, 18-413 Miastkowo",Kazimierz Ustaszewski,48-608-338-888,,15.04.03,14.04.08,Construction lumber 35000,,
Wellton sp. z o.o.,SW-COC-935,Poland,Europe,"Jaromierz 101A, Kopanica, 64-225",Mateusz Kwiczak,48683840865,48686840084,kwiczak@hoga.pl ,,15.04.03,14.04.08,Fencing Furniture - outdoor / garden Garden supplies Sawdust
"PPHU ""MAT-BUD"" KAZAK sp.j.",SW-COC-936,Poland,Europe,"ul. Ogrodowa 8, 64-962 Sypniewo",Jan Kazak,48672661234,48672661296,biuro@mat-bud.pl ,,15.04.03,14.04.08,Sawdust Lumber Boards Green and kiln-dried Chips
Firma Handlowo Uslugowo Produkcyjna Mariusz Niski,SGS-COC-1385,Poland,Europe,"2B/12 Zarebska St, 06-330 Chorzele",Mr. Mariusz Niski,+48 604 524 063,,05.04.03,04.04.08,Broker activity.,,
STOLARSTWO Piotr i Zofia Romaniak,SGS-COC-1382,Poland,Europe,"12 Wisenna St., 58-540 Karpacz",Mr. Roman Romaniak,48 75 76 19 938,,05.05.03,04.05.08,"Fences, pergolas etc.",,
Zaklady Plyt Pilsniowych S.A.,SGS-COC-1369,Poland,Europe,17 Ofiar Katynia St. 37-700 Przemysl,Jan Ozimek,48 16 678 04 04,48 16 678 04 41,,22.04.03,21.04.08,Fibre boards & refined fibre boards,
MAKPOL sp. z.o.o.,SW-COC-914,Poland,Europe,34-223 Zawoja 281,Jozef Mrowiec,48 33 87 75 101,48 33 87 75 145,,15.04.03,14.04.08,Boards Green and Kiln Dried 8500 Custom millwork Kiln drying,
Zaklady Przemyslu Sklejek BIAFORM SA,SGS-COC-1394,Poland,Europe,"24 Dojlidy Fabryczne Str., 15-566 Bialystok",Mr. Janusz Tichoniuk,48 85 74 10 359,48 85 74 10 365,,16.05.03,15.05.08,Plywood,
"Kora L. Jamer, B. Jamer, W. Imiolo sp. j.",SW-COC-857,Poland,Europe,32-828 Biadoliny Szlacheckie 190,Lucyna Jamer,48146657800,kora@poczta.okay.pl ,,15.01.03,14.01.08,Lumber (kiln-dried) Lumber (green Custom manufacturing Finishing Kiln drying,
Firma Produkcyjno-Handlowo-Uslugowa “DREWNOMEX”,SGS-COC-1431,Poland,Europe,"32 Tetmajera St, 12-100 Szczytno",Mr. Leszek Bula,48 89 624 47 32,,23.06.03,22.06.08,,,
P.H.U.P. DALBO Sawicki-Ferdynus,SW-COC-962,Poland,Europe,"Przeclaw 6 Niegoslawice, 57-512",Stanislaw Sawicki,48683781170,curt@polbox.com ,,01.05.03,30.04.08,Fencing Furniture - outdoor / garden Garden supplies Sawdust,
ZPUH AS-COR Andrzej Sobieraj,SW-COC-977,Poland,Europe,64-316 Michorzewo 1B,Andrzej Sobieraj,48614473238,as-cor@o2.pl ,,15.05.03,14.05.08,Doors Fencing Flooring Furniture - outdoor / garden Garden supplies Wood chips Sawdust Windows Boards Panels,
PRAETOR Sp. z o.o.,SGS-COC-1434,Poland,Europe,3 lok. 8A Jezuicka St. 85-102 Bydgoszcz,Mr. Tadeusz Ziolkowski,48 52 322 61 29,48 52 322 61 29,,03.07.03,02.07.08,Broker activity.,
PINEWOOD INDUSTRY Sp. z o.o.,SGS-COC-1443,Poland,Europe,34 Tartaczna Str. 16-300 Augustow,Marcin Augustynowicz,+48 87 644 3115,,08.07.03,07.07.08,Doors,,
Przedsiebiorstwo Eksportowo-Importowe “BOSS” Sp. z o.o.,SGS-COC-1446,Poland,Europe,"Kurzyna Srednia 64 a, 37-410 Ulanow",Mr. Antoni Brzozowski,+48 15 87 65 114,+48 15 87 65 114,,18.07.03,17.07.08,Sawn timber,
Forest Style Polska Sp. z o.o.,SGS-COC-1451,Poland,Europe,"14c/4 Armii Krajowej St., 50-541 Wroclaw",Mrs. Beata Szeliga,+48 71 336 25 43,+ 48 71 795 06 34,,12.07.03,11.07.08,Broker activity.,
„Przemysl Drzewny” Spoldzielnia Przemyslu Ludowego i Artystycznego,SGS-COC-1452,Poland,Europe,"7 Zurowa, 38-247 Olpiny",Edward Rutkowski,+ 48 14 651 83 23,+ 48 14 651 83 26,,18.07.03,17.07.08,kitchenware products,
Zaklad Drzewny “TARTAK” s.c.,SGS-COC-1456,Poland,Europe,"Swidwiborek 3, 07-430 Myszyniec",Mr. Tomasz Domian,+48 29 772 14 14,,24.07.03,23.07.08,Sawn timber,,
Zaklad Stolarski Roman Chudy,SGS-COC-1351,Poland,Europe,"21A Swiatniki Male, 62-212 Mieleszyn",Mr. Roman Chudy,48 61 427 16 15,48 61 427 19 88,,04.04.03,04.04.08,Wooden garden products,
Przedsiebiorstwo Produkcyjno-Handlowo-Uslugowe “LIBRA”,SGS-COC-1379,Poland,Europe,"37/7 Barcza St., 10-685 Olsztyn",Mr. Tadeusz Polaczuk,48 89 534 36 02,,05.05.03,04.05.08,Sawn timber and stripes etc.,,
ZPH PINUS - Malgorzata Nagier,SGS-COC-0523,Poland,Europe,"76 3 Maja St., 37-410 Ulanow",Mr. Jerzy Nagier,+ 48 15 8763 414,+ 48 15 8763 414,,19.09.00,19.09.05,"Pine trays, shoes and flower stands, boxes, shelves, stools, ladders cassette and magazine rack, bird houses, CD cabinet, storage boxes",
GPD S.A,SGS-COC-0486,Poland,Europe,Gdanski Przemysl Drzewny S.A.15 Hutnicza 81-038 Gdynia,Mr. Jaroslaw Kaniecki,+ 48 58 3021241,+ 48 58 3020120,,13.07.00,13.07.05,"Production and export of hardwood & softwood timber, building woodwork, wood flooring, wainscot panels, glued laminated boards and garden wooden products",
ZD Rejon Las,SGS-COC-0496,Poland,Europe,"24 Lubelska St., 37-470 Zaklików",Mr. Marek Klak,+ 48 15 8738414,+ 48 15 8738414,,26.07.00,26.07.05,"Sawn timber, furniture elements, floor boards, banded panels.",
CHERRYWOOD INDUSTRY Sp. z o.o.,SGS-COC-0498,Poland,Europe,"2 Cieliczanska St., 16-030 Suprasl",Sam Avny,+ 48 85 675 1248,+ 48 85 675 1248,,26.07.00,26.07.05,"Wooden products “do it yourself” rack, storage chest, storage box, flower pots, small fences, children chair, shelves, tables, slatted table, planter",
EKOPLYTA S.A.,SGS-COC-0505,Poland,Europe,"2 Przemyslowa St., 64-700 Czarnkow",Mr. Tomasz Lucjan,+48 67 35 60 999,+48 67 35 60 900,,21.08.00,21.08.05,"Production and export of soft fibre boards, dry wooden fibre and insulation mats.",
KPPD S.A,SGS-COC-0463,Poland,Europe,"KPPD S.A., 2 3Maja St., 78-400 Szczecinek",Mr. Longin Graczkowski,Fax: ,+ 48 94 374 35 48,,19.05.00,19.05.05,"production, export and broker activity of sawn timber, strips, wooden garden products and sawmill co-products with 100% content of certified raw material at ZPD Slawoborze, manowo, Swidwin and Krosino. And70& of cerft. Raw material at ZPD Lubowo, Swierczyna, Bialogard and Czaplinet. And 100% content of certf material and 70% for sawmill co-products at ZPD Kolacz, Drawsko Pomorskie, Wierzchowo and Kalisz Promorski",
Kaczkan S.C. Zpd import-export,SGS-COC-0476,Poland,Europe,"Kielkuty, 14-335 Dobrocin",Mr. Henryk Kaczkan,+ 48 89 758 61 10,+ 48 89 758 65 03,,30.06.00,30.06.05,beech and oak sawn timber and strips,
Koniecpolskie Zaklady Plyt Pilsniowych S.A.,SGS-COC-0537,Poland,Europe,"3 Kolejowa St., 42-230 Koniecpol",Mr. Jan Gwiazda,+ 48 34 355 24 40,+ 48 90 355 384,,01.09.00,01.09.05,Hard and soft fibre boards,
Kronowood SP.z o.o.,SGS-COC-0519,Poland,Europe,"3 Wojska Polskiego St., 39-300 Mielec",Ms. Tomasz Janczak,+ 48 17 788 52 00,+ 48 17 788 53 00,,18.09.00,18.09.05,Production and export:Laminated floor and wall panels based on HDF and LDF boards containing at least 70% certified virgin fibre and from chip boards containing at least 30% certified virgin fibre; Worktops and windowsills based on chip boards containing at least 30% certified virgin fibreSkirting (MDF profiles) based on MDF containing at least 70% certified virgin fibreMDF boards containing at least 70% certified raw material,
Przedsiebiorstwo-Produkcyjno-Handlowe Marek Szalkowski,SGS-COC-0249,Poland,Europe,"3 / 4 Armii Krajowej St., 67-100 Nowa Sol, Poland",Marek Szalkowski,+ 48 68 387 86 95,+ 48 68 387 86 95,,09.04.99,08.04.09,"Purchase of raw material, production, sale and export of barrel planters and wooden garden products.",
ROSERAIE Sp. z o.o.,SGS-COC-0521,Poland,Europe,"9 Pszczelarska St, 52-210 Wroclaw",Giuseppe Lissignoni,39 03544 23118,39 0358 43107,,19.09.00,19.09.05,Parquet & floor profiled skirting,
P.H.U.T BARTOSZ,SGS-COC-0433,Poland,Europe,"50 Nowe Polaszki, 83-433 Stare Polaszki",Mr. Marian Orlikowski,+ 48 58 687 61 03,+ 48 58 687 61 03,,16.03.00,16.03.05,production and export of Garden furniture products from wood,
Kronopol Sp. Z.o.o,GFA-COC-1008,Poland,Europe,"ul. Serbska 56, 68-200 Zary",Mr. Joachim Hasch,+48 68 36 31 100,+48 68 36 31 321,j.hasch@kronopol.com.pl ,,26.09.00,25.09.05,"Medium Density Fireboard (MDF), OSB Engineered Wood, particle board, laminated (flooring) panels, working board, skirtings, furniture elements, working tops"
Ante-holz Polska Sp. z.o.o,SCS-COC-00187,Poland,Europe,"ul. Spoldzielcza 2, PL 67120, Kozuchow",Mr. Thomas Walter,0048-68355-3424,0048-683-5535-24,thomas.walter@ante-holz.de ,,01.11.00,01.11.05,"Fences, Palisades, Boards and Outdoor Furniture."
"Galicja Art, SP.",SGS-COC-0089,Poland,Europe,94 Kosciuszki St. 38-300 Gorlice,Mr. Mike Wall,01-342-835-800,01-342-836-234,,09.01.98,07.01.08,Production of export of beech and pine kitchenware products.,
Zaklad GRABO Waldemar Irzyk,SGS-COC-0095,Poland,Europe,36-208 Niebocko 110,Mr. Waldemar Irzyk,+48 13 4395098,+48 13 4395096,info@grabo.com.pl ,www.grabo.com.pl,01.02.03,01.02.08,"production and export of sawn timber, strips, parquet, furniture elements, bonded panels and bonded floor panels from solid wood."
PPD Poltarex Sp Zoo,SGS-COC-0195,Poland,Europe,"9/10 Zeromskiego St, 84-300 Lebork",Mr. M. Kubiak,-621693,-622427,,20.11.98,20.11.08,"Sawn timber, sawmill coproducts and of garden furniture.",
JAGRAM S.A.,SGS-COC-0201,Poland,Europe,"8/16 Dobrowaja St, 04-003 Warszawa",Mr. A. Nietubyc,-254028,-289950,,01.12.98,30.11.08,Garden furniture,
FS FAVORIT FURNITURE,SGS-COC-0216,Poland,Europe,"2 Gnieznienska St., 12-100 Szczytno",Mr. Jozef Borawski,-4084,-6594,,27.01.99,26.02.09,Solid pine furniture (Very Wood Collection),
FENIX-METAL Biuro Handlu Zagranicznego Sp. z o. o.,SGS-COC-0227,Poland,Europe,"Fenix-Metal, Biuro Handlu Zagranicznego Sp.Z.o.o, 84/92 Marszalkowska, 00-514 Warszawa",Ms. Ewa Styczynska,-7853,-3675,,12.02.99,12.02.09,Export of wooden products.,
SWEDWOOD Poland S.A. Oddz. GRUPA Tartaki,SGS-COC-0783,Poland,Europe,"31 Witosa St., 72-100 Goleniow",Mr Wojciech Chlubek,+ 48 91 418 23 13,+ 48 91 418 91 05,,08.08.01,07.08.06,pine & spruce products and sawmill co-products,
Kronospan PL,SGS-COC-0520,Poland,Europe,"1 Waryskiego St., 78-400 Szczecinek",Neil Foot,35 35188 1233,35 3518 5130,,18.09.00,18.09.05,"Production and export of HDF, MDF, and LDF boards, laquered HDF board, laminated MDF boards, wall panels, skirting & profiles, pressed doorskins and pressed SHEN TOP dorskins containing at least 70% of certified virigin fibre",
ROTO-FRANK S.A,SCS-COC-00134,Poland,Europe,"ul. Lubelska 104, 21-100 Lubartow",Mr. M. Trimborn,48-81-855-4016,48-81-855-4034,waldemar.gajewski@roto-frank.com ,www.roto-frank.com,01.09.99,31.12.04,Laminated roof window frames and loft ladders
B&D Sp. z o.o.,SGS-COC-0173,Poland,Europe,"7 Pszczela Str., 56-321 Bukowice",Mr. Jozef Burchard,+ 48 62 785 81 21,48-71-3845026,,16.10.98,14.10.08,Garden wooden products,
Drewex,SGS-COC-0020,Poland,Europe,"Drewex, UL. Strazacka 80, 43-382 Bielsko-Biala",Mr. Don Powell,0121 377 6077,0121 377 6063,,27.02.01,26.02.06,Wooden products,
GPPD Forest Sp. z o.o.,SGS-COC-0125,Poland,Europe,"9 Biecka St., 38-300 Gorlice,",Stanislaw Wyporski,+ 48 18 353 76 60,+ 48 18 353 51 95,,06.03.98,01.06.08,"wooden clothes hangers, kitchenware products",
"Firma ""Gorgol""",SGS-COC-0152,Poland,Europe,37 Kmicica St. 42-200 Czestochowa,Mr. Marius Ryterski,48 3465 9010,48 3465 9270,,24.07.98,23.07.08,Furniture elements,
GRYFSKAND Sp zoo,SGS-COC-0178,Poland,Europe,"4 Fabryczna St, 74-100 Gryfino",Mr. B Izdebski,48-914045086,48-914164177,,19.10.98,18.10.08,The production and export of charcoal and charcoal briquettes,
"Aleska sc, AI.M.B.",SGS-COC-0088,Poland,Europe,"Fatimskiej 33, 34-100 Watowice",Mr. Mike Wall,01342 835 800,01342 836 234,,01.09.98,01.08.03,Hardwood kitchen products.,
PUP COMPLEX,SGS-COC-0094,Poland,Europe,"7/9 Kosciuszki Str., 80-451 Gdansk",Mr. Tomasz Milewski,48 58 341 00 95,48 58 345 50 72,,01.02.98,08.01.08,Production and export of garden wooden products,
Remix Sp a.o.o.,SGS-COC-0153,Poland,Europe,REMIX Sp. z o.o. Abrahama 10 St 84-300 Lebork,Mr. Wojciech Karlikowski,48-59661409,48-59662665,,24.07.98,23.07.08,"Sawn lumber, timber moldings",
Seegerdach SP z.o.o.,SGS-COC-0014,Poland,Europe,"Lebieniec 64, 84-360 Leba",Wojciech Karlikowski,+48.59.866.2729,+48.59.866.2865,,31.12.01,30.12.06,"Glue-laminated, joinery products and sawmill co-products",
PPD Jerzy Czarnecki,SGS-COC-0438,Poland,Europe,"2 Sportowa St., 89-200 Szubin",Mr. Jerzy Czarnecki,+ 48 52 384 22 21,+ 48 52 384 22 21,,16.03.00,16.03.05,Pine lamp elements and pine flower holders,
Anders Sp. Z.o.o.,SCS-COC-00124,Poland,Europe,"Ul. Przemyslowa 15, 42-160 Knepice",Mr. Matthias Zscjieschang,48-34-317-5264,48-34-317-5268,www.anders-gruppe.de,01.07.99,15.11.04,Laminated pine windows.,
PPUH DREWMEX,SGS-COC-0435,Poland,Europe,"P.P-U-H. DREWMEX, 30 Sw. Rocha St.27-215 Wachock",Mr. Tomasz Bujak – Managing Director,+ 48 41 271 57 12,+ 48 41 271 53 37,,16.03.00,16.03.05,Wall-paper pasting tables.,
EX-PRO P.P.H.U.T.,SGS-COC-0399,Poland,Europe,"EXPRO P.P.H.U.T, Import-Export, 77-207 Piaszczyna 10",Mr. Boleslaw Prondziski,+ 48 59 8571318,+ 48 59 8571318,,13.01.00,12.01.05,"garden wooden products (fences, pergolas, roll- bolders, palisades, sawmill coproducts)",
Agrotech Sp. Z.o.o.,SGS-COC-0402,Poland,Europe,"Agrotech Sp. Z.o.o. 1 Sienkiewicza St., 67-200 Glogow",Mr. Jan Perzanowski,+48-76-834-23-53 ext. 33,-890,,14.01.00,14.01.05,Charcoal and fire wood.,
Zenpol Sp z.o.o,SGS-COC-0403,Poland,Europe,"20 Sloneczna St., 66-100 Sulechow",Mr. Zenon Swigon,-5319,48-68-385-4914,,27.01.00,26.01.05,Beech brushes and boot-scrapers from certified wood.,
P.P.U.H. Hamar,SGS-COC-0409,Poland,Europe,10/1 Reja St. 87-800 Wloclawek,Mr. Andrzej Benedykcinski,-1551,-284,,01.02.00,01.02.05,Graden wooden products & Construction timber,
"Umi-Drex, S.C.",SGS-COC-0408,Poland,Europe,"UMI-DREX, S.C. 4 Lubawska St., 14-200 Iilawa",Arkadiusz Wnuk,-3638,-9072,,01.02.00,01.02.05,Wooden Products: Garden furniture.,
ZPD LP Lebork,SGS-COC-0407,Poland,Europe,"25 I Armii, WP St. 84-300, Lebork",Ms. Elzbieta Popiel,+48-59-621 649,+48-59-621 693,,01.02.00,01.02.05,"Sawn timber, strips, pallet & furniture elements, battens, wainscots and sawmill co-products.",
DLH Nordisk Sp. z o.o.,SGS-COC-0422,Poland,Europe,DLH Nordisk Sp.z o.o.3 Kolobrzeska St.78-230 Karlino,Mr. Jan Karpinski,+ 48 94 311 71 00,+ 48 94 311 72 75,,04.10.01,06.03.05,"sawn timber, strips, furniture elements",
PAGED S.A.,SGS-COC-0425,Poland,Europe,"18 Trzech Krzyzy Sq.,00-950 Warszawa",Mr. Miron Trzeciak,+ 48 22 6238144,+ 48 22 6283942,,07.03.00,07.03.04,"wooden products, sawn timber, fibreboards",
CLASSEN-POL,SGS-COC-0286,Poland,Europe,"Zwonowice, Wyzwolenia St, 44-292 Rybnik",Mr. Zbigniew Zadworny,+ 48 32 4292 101,+ 48 32 4292 108,,28.06.99,28.06.09,The production of raw lamellar and panel doors from sawn timber,
"Zaklady Przemyslu, Drzewnego RUDY",SGS-COC-0064,Poland,Europe,"Zaklady Przemyslu, Drzewnego RUDY, 14 Glinianska St, 33-100 Tarnow",Mr. Jan Bulwan,0048-14215621,0048-14215621,,30.06.97,17.06.07,production and export of hardwood products,
MARTYNA Sp. z o.o,SGS-COC-0915,Poland,Europe,62 – 106 Rabczyn,Waldemar Chudzik,+ 48 67 26 16 209,+ 48 67 26 16 209,,31.12.01,31.12.06,"Production and export of roll-borders, palisades and hunting fences",
Prospan Spolka Akcyjna,SGS-COC-0816,Poland,Europe,"10 Boleslawiecka St., 98-400 Wieruszow",Mr. Jan Kowalski,+48 62 78 33100,+ 48 62 78 33127,,19.10.01,18.10.06,Production and export of chip boards containing at least 33% certified maerial,
Pfleiderer GrajewoSA,SGS-COC-0815,Poland,Europe,"1 Wiorowa St., 19-203 Grajewo",Mr. Jan Kowalski,+48 86 272 3261,+48 86 272 4413,,19.10.01,18.10.06,Production and export of chip boards containing at least 33% certified maerial,
Orzechowskie Zaklady Przemyslu Sklejek,SGS-COC-0842,Poland,Europe,"13 Miloslawska St., 62-322 Orzechowo",Jerzy Olszowy,+48 61 437 1091,+48 61 437 1071,,15.11.01,15.11.06,Production and export of external and internal plywood containing 100% certified material and oak & beech refined plywood and shelf support containing at least 70% certified material,
KRAKPOL S.A.,SGS-COC-0853,Poland,Europe,"1 Polonijna St., 30-668 Krakow",Mr. Adam Dembowski,+ 48 12 658 09 04,+ 48 12 658 20 52,,05.12.01,05.12.06,"Production and export of wooden toys containig100% or 70 % of certified material (train elements, train sets and trains spare)",
Zaklady Drzewne “MADREW” s.c.,SGS-COC-0856,Poland,Europe,32-447 Siepraw 817,Mr. Wladyslaw Nowak,+ 48 12 274 60 49,+ 48 12 274 60 49,,05.12.01,04.12.06,"Production and export of wooden kitchenware products, brush handles and strips.",
Texpol Sp. Z.o.o.,SGS-COC-1019,Poland,Europe,4 Lany St. 32-700 Bochnia,Mrs Agata Cantini,+ 48 14 615 2511,+ 48 14 615 2527,,01.05.02,01.05.07,"sawn timber, strips and bonded panels",
