COMPANY,FSC_CODE,COUNTRY,CONTINENT,ADDRESS,CONT_PER,TELEPHONE,FAX,EMAIL,WEBSITE,ISSUDATE,EXPDATE,PRODUCTS
Wistoba Pinselfabrik,SGS-COC-1442,Germany,Europe,"Karl-Schmidt-Str. 4, 37431 Bad Lauterberg-Barbis",Mr. Arndt W. Stollberg,+49 5524 8609 20,+49 5524 8609 60,,,08.07.03,07.07.08,"Mainly beech, large variety of paint brushes"
R. Ulrich & Co. GmbH,SCS-COC-00544,Germany,Europe,Stenzelring 21 D-21107 Hamburg,Lutz Neukirchner,49- 040/756011 – 0,49- 040/756011 – 70,info@ulrich-veneers.com ,www.ulrich-veneers.com,07.08.03,07.08.08,All kind of veneer woods
F.W. Barth & Co. GmbH,SCS-COC-00536,Germany,Europe,Fuggerstraße 9 41352 Korschenbroich,Frank Sauter,49 (0)2161-995 599,49 (0)2161-995 3001,www.barths-hamburg.de,,05.08.03,04.08.08,"Distributor of sawn wood, garden furniture, solid flooring and 3 - layer engineered real wood flooring (Minimum 70%)."
Beyer-Furniere,SCS-COC-00551,Germany,Europe,Werner Forßmann Str. 14,Günter Beyer,49- 04171/68110,49- 04171/68618,info@furnierwerk-prignitz.de ,www.furnierwerk-prignitz.de,05.08.03,04.08.08,Distribution of Veneer and Roundwood
J. A. Molfenter GmbH & Co. KG,SCS-COC-00566,Germany,Europe,Blaubeurer Straße 82 D-89077 Ulm,Hermann A. Scheuffele,49/0731/165255,49/0731/165274,h-a.scheuffele@moco.de ,www.moco.de,25.07.03,25.07.08,Manufacturer and distributor of moulded boards and mouldings. Minimum 70% FSC-certified content
J. Hauskeller GmbH,SCS-COC-00563,Germany,Europe,"P.O. Box 1309, D-27343 Rotenburg/Wuemme, GERMANY",Jost Hauskeller,49 (0)4261-3350,49 (0)4261-1738,j.hauskeller-gmbh@t-online.de' ,,24.07.03,23.07.08,
HVI Gesellschaft Für Handel Und Verwaltung GmbH & Co KG Generalbevollmächtigter,SCS-COC-00559,Germany,Europe,HVI Gesellschaft Für Handel Und Verwaltung GmbH & Co KG Generalbevollmächtigter Düsternstr. 73 D-48231 Warendorf,Roland Kann,49 (0)2581-2746,49 (0)2581-62800,norbert.fleischer@hvi-beo.de ,,10.07.03,09.07.08,Distribution of 100% FSC-certified outdoor furniture
Braun & Würfele GmbH,SW-COC-1005,Germany,Europe,"Mähderstr, 29-32 Beiersbronn, 72270,",Mr. J. Würfele,49 7442 8438 12,49 7442 8438 88,j.wuerfele@braun-wuerfele.de ,www.braun-wuerfele.de,01.09.03,31.08.08,Decking (exterior) Wooden garden constructions and planks Fencing Wooden garden constructions
Haymann GmbH & Co,SCS-COC-00450,Germany,Europe,"Haymann GmbH & Co, Killektionen Auf der Heide 2, D 57629 Norken",Mr. Karin Herrmann,+ 49 2661 9554 0,+ 49 2661 9554 100,info@haymann.de ,www.haymann.de,17.07.02,17.07.07,Garden furniture
Kahrs & Schulz OHG,GFA-COC-1059,Germany,Europe,"Holzwerkstatt Upper Borg 47, 28357 Bremen",Mr Kahrs,+ 49 421 271 834,+ 49 421 274 274,ks.holzwerkstatt@t-online.de ,,21.05.02,20.05.07,carpenter products all types
Tischlerei Winter,GFA-COC-1060,Germany,Europe,"Senator-Bömers-Straße 21, 28197 Bremen Deutschland",Mr Winter,+ 49 421 544 1641,+ 49 421 544 163,tischlerei_winter@t-online.de ,,21.05.02,20.05.07,carpenter products all types
Uslar u. Morisse Tischlerei und Fensterbau GmbH & Co. KG,GFA-COC-1061,Germany,Europe,"Vorbrucher Straße 42, 28790 Bremen",Mr. Morisse,+ 49 421 6800 8861,+ 49 421 6800 8888,,,21.05.02,20.05.07,carpenter products all types
Tischlerei Voß,GFA-COC-1062,Germany,Europe,"Haferwende 42, 28357 Bremen",Mr. Voß,+ 49 421 276 8033,+ 49 421 276 8034,,,21.05.02,20.05.07,carpenter products all types
H. Dühnfort Bau- und Möbeltischlerei GmbH,GFA-COC-1064,Germany,Europe,"Kleine Marschstraße 19, 28309 Bremen",Mr Dühnfort,+ 49 421 413 121,+ 49 421 450 688,info@tischlerbremen.de ,,21.05.02,20.05.07,carpenter products all types
"Legno Mobili, Die Möbeltischlerei",GFA-COC-1065,Germany,Europe,"Franz- Grashof-Str.16, 28201 Bremen",Mr. W. Bruns,+ 49 421 871 777 0,+ 49 421 871 777 4,legno-mobili@t-online.de ,,21.05.02,20.05.07,carpenter products all types
Tischlerei Schwän,GFA-COC-1066,Germany,Europe,"Malerstr. 52 A, 28207 Bremen, Deutschland",Mr. Thomas SchwÄn,+ 49 421 445 566,49 421 4984515,info@tischlerei-schwaen.de ,,21.05.02,20.05.07,carpenter products all types
Egger Holzwerkstoffe Wismar GmbH & Co. KG,GFA-COC-1067,Germany,Europe,"Am Haffeld 1, 23970 Wismar",Mr. Jörg Götz,+ 49 3841 301 21 320,+ 49 3841 301 61 320,joerg.goetz@egger.com ,www.egger.com,21.05.02,20.05.07,"wood based panel, (OSB, MDF, HDF, DHF)"
Carl Heinz Langner GmbH & Co KG,SCS-COC-00436,Germany,Europe,"Östliche Feldstraße 54, D 32429 Minden-Häverstädt, Deutschland",Mr. Carl Heinz Langner,+ 49 571 95604-0,+ 49 571 956 0499,langner-Minden@gmx.de ,www.langner-furniere.de,18.06.02,18.06.07,"veneer, sawn timber and logs"
Kronospan GmbH Sandebeck,SGS-COC-1057,Germany,Europe,"Leopoldstaler Str. 195, D-32839 Steinheim",Mr. Liebeck,+ 49 5238 984 381,+ 49 5238 984 301,,,30.05.02,30.05.07,particle and fibre boards from industrial round wood and recycled waste wood
ETS Flooring GmbH,GFA-COC-1068,Germany,Europe,"Am Haffeld 1, 23970 Wismar",Mr. Roman Rappel,+ 49 3841 301 210,+ 49 3841 301 61 320,roman.kappel@egger.com ,www.egger.com,21.05.02,20.05.07,Laminated Flooring
E.F.P. Floor Products Fussböden GmbH,GFA-COC-1073,Germany,Europe,"Am Haffeld 1, 23970 Wismar",Mr Jörg Götz,+49 3841 301 21 320,+49 3841 301 61 320,klaus.nagel@egger.com ,www.egger.com,21.05.02,20.05.07,laminatfussboden
Lorenz Heckelmann & Söhne oHG,SCS-COC-00526,Germany,Europe,Schlingenstraße 17 97705 Burkardroth-Waldfenster,Mr. Jochen Wehner,49 9734/9111-0,50 16/19,info@heckelmann.com ,www.heckelmann.com,31.03.03,31.03.08,"Wooden articles for household and garden, Solid wood and assembled products with minimum 70% FSC"
Landmann-Peiga Handels GmbH & Co.KG,GFA-COC-1071,Germany,Europe,"Am Binnenfeld 3, 27722 Osterholz - Scharmbeck",Peter Schmidt,+ 49 2058 92 18 30,+49 4791 308 35/-36,schmidt@landmann-peiga.de ,,31.05.02,30.05.07,"Garden furniture, grills and barbeque accessories, charcoal"
D. Patzwahl GmbH,SCS-COC-00425,Germany,Europe,"Langenberger Str. 3, 40233 Düsseldorf",Mr. Suitbert Barbers,+ 49 211 733 6842,+ 49 211 733 6844,info@holzbau-patzwahl.de ,www.holzbau-patzwahl.de,17.05.02,17.05.07,"bridges, fences, benches, wooden terraces"
Theodor Nagel GmbH & Co,SCS-COC-00448,Germany,Europe,"Holzimport Billstraße 118, D 20559 Hamburg, Deutchland",Mr. Dieter Krauth,+ 49 40 7811 0060,+ 49 40 7811 0024,info@theodor-nagel.com ,www.theodor-nagel.com,17.07.02,17.07.07,"Solid Timber from all over the world (Cedro, Spanish Cedar, Jatoba, Macaranduba, Bullet wood, Ipe, Cumarz, Pau Amarelo, Cerejeira, Brazilian Oak"
Ing.-Holzbau Busmann GmbH,SCS-COC-00464,Germany,Europe,Nordring 60 48465 Schuttorf,Edgar Molendyk,05923-9642-0,05923-4163,brueckenbau@busmann-holzbau.de ,www.busmann-holzbau.de,07.08.02,07.08.07,"Bridges, outdoor benches and flooring"
Egger Holzwerkstoffe Brilon GmbH & Co. KG,GFA-COC-1075,Germany,Europe,"Im Kissen 19, 59929 Brilon",Mr. Ferdinand Martini,+49 2961 770 390,+49 2961 770 88 390,ferdinand.martini@egger.com ,,01.08.02,31.07.07,Particle Board and MDF
E.F.P. Floor Products Fussboden GmbH,GFA-COC-1076,Germany,Europe,Im Kissen 1959929 BrilonDEUTSCHLAND,Ferdinand Martini,+49-2961-770 390,+49-2961-770 88 390,ferdinand.martini@egger.com ,www.egger.com,01.08.02,31.07.07,Laminated Flooring
EDP Egger - Do it yourself - Products GmbH & Co. KG,GFA-COC-1077,Germany,Europe,"Im Kissen 19, 59929 Brilon",Mr. Ferdinand Martini,+49 2961 770 390,+49 2961 770 88 390,ferdinand.martini@egger.com ,www.egger.com,01.08.02,31.07.07,Trade with wood based panel products
Runge GmbH & Co KG,SCS-COC-00465,Germany,Europe,"Grosser Fledderweg 89, 49026 Osnabrück",Uwe Krohn,+49-541-5055 240,49-541-5055 241,u.krohn@runge-online.com ,www.runge1908.de,27.08.02,27.08.07,Outdoor furniture with timber from FSC-endorsed certified forest operations
Hudimex GmbH,SCS-COC-00472,Germany,Europe,"Im Gewerbepark 8, D 27798 Hude",Mr.Tammo Seiferheld,49-4408-926-0,49-4408-926-29,info@seiferheld.de ,www@seiferheld.de,24.09.02,24.09.07,Import/Export Broker of Sawnwood and Roundwood from FSC-endorsed certifed forest operations.
MSCO Holz Im- und Export GmbH,SCS-COC-00498,Germany,Europe,Holzimport und Hobelwerk Liebigstr. 64 D 22113 Hamburg,Mr. Michael Stawiak,+ 49 40 73330 01,+ 49 40 73330 277,m.stawiak@holz-import.de ,www.holz-import.de,03.01.03,03.01.08,Distributor of Sawn wood (100% FSC-certified) and wood-based panels. Manufacturer of mouldings.
Katharina Bouchon GBR,SCS-COC-00535,Germany,Europe,"Handelsvertretung, Am Mühlenfeld 23 D-51491 Overath",Ms Katharina Bouchon,49-(0) 2204/426 601,49-(0) 5272/426 603,V.Bouchon@t-online.de ,,23.04.03,23.04.08,Back-to-back brokering for garden furniture
H.G.V. Haus und Garten - Marketing - un Vertriebsgesellschaft mbH,SCS-COC-00534,Germany,Europe,Kleinottweilerstr. 75 66450 Bexbach,Mr. Frank Quade,49 (0) 6826/9225-0,49 (0) 6826/9225-25,H.G.V.-germany@t-online.de ,,23.04.03,23.04.08,Garden Furniture
Hiram GmbH,IMO-COC-22157,Germany,Europe,"Appenweirer Str 45, D, 77704 Oberkirch",Mr. Fischer,+ 49 7802 7008 70,+ 49 7802 7008 80,,,19.09.02,31.12.04,round timber
Pfleiderer Holzwerkstoffe GmbH & Co. KG.,SGS-COC-1117,Germany,Europe,"Am Frankenbrink 5, D-33378 Rheda-Wiedenbrueck",Ms Beyer,49 5242 419 150,49 5242 419 210,christiane.beyer@pfleiderer.com ,,14.08.02,14.08.07,"manufacture of raw and coated chipboards, containning a minimum of 30% certified raw material"
Friesdorfer Holzwaren GmbH,SGS-COC-1507,Germany,Europe,"Am Bahnhof, D-06543 Friesdorf",Mr. Gerhard Kulessa,+49 (0)34775 203 27,+49 (0)34775 203 26,,,04.09.03,03.09.08,"Mainly beech, large variety of tool handles, 400 items at present"
Topo Handelsgessellschaft GmbH,GFA-COC-1070,Germany,Europe,"Eiffestr. 598 20537 Hamburg, Deutschland",Mr. Gärtner,+ 49 40 210 9790,+ 49 40 210 97 215,info@topo-hamburg.de ,,27.06.02,26.06.07,"Garden furniture and accessoires, sanitary and household articles, doors"
Tischlerei Curdt,GFA-COC-1042,Germany,Europe,"Osterrade 22, 21031 Hamburg",Mr Curdt,+ 49 40 7303 592,+ 49 40 738 4837,rainer.curdt@curdt.de ,,12.12.01,11.12.06,carpenter products
Interwood GmbH,SGS-COC-1119,Germany,Europe,"Ingolstaedter Straße 51, 92318 Neumarkt",Mr. Alois Kraus,49 9181 28 436,49 9181 28 582,alois.kraus@pfleiderer.com ,,14.08.02,14.08.07,"industrial round wood, industrial waste wood and wood chip products"
Eibe Produktion + Vertrieb GmbH & Co.,SGS-COC-1315,Germany,Europe,"Industriestraße 1, D-97285 Röttingen",Mr. P. Schnabel,49 9338 89 900,49 9338 89 949,eibe@eibe.de ,,07.02.03,07.02.08,Production of playgrounds and park furniture containing a minimum of 70% FSC raw material.
Forstbetrieb Steidl,SGS-COC-1316,Germany,Europe,Egenolfstr 22 a D-65599 Dornburg-Frickhofen,Mr. Hermann Steidl,49 6162 733 84,49 6162 733 84,,,07.02.03,07.02.08,wood harvesting and trading. Industrial roundwood and sawmill roundwood assortments
Ploss & Co. GmbH,SGS-COC-0676,Germany,Europe,"Stemwarder Landstrasse 15, 22885 Barsbuettel",Mr. Harald Ploss,+49 40 537 1610,+49 40 53 71 6151,,,16.05.01,16.05.06,Handel mit Gartenmöbeln und –accessoires. Trading with garden furniture and accessories.
Rettenmeier Holzindustrie Wilburgstetten GmbH & Co. KG,SGS-COC-0689,Germany,Europe,"Industriestrasse 1, D-91634 Wilburgstetten",Mr. Dürr,+ 49 9853 338 450,+ 49 9853 338 100,,,15.05.01,15.05.06,Trading with woodfibre underlay boards as well as parquet and flooring laminate
Renokit GmbH,SGS-COC-0847,Germany,Europe,"Fabrikstationsstrasse 18-26, D-68163 Mannheim",Ms. G. Podgorski,+ 49 621 833 9612,+ 49 621 833 9619,,,27.11.01,27.11.06,Trading in furniture and other wooden products
Holzwerk Kübler GmbH,SGS-COC-0860,Germany,Europe,"Schattbucher Str. 16, D-88279 Amtzell",Mr Volker Kübler,-17055,-14158,,,07.12.01,06.12.06,Production and trading of wooden garden items and prefabricated wood constructions
"IB Holzkohle Vertriebsgesellschaft mbH, Holzkohlewerk Lüneburg",SGS-COC-0861,Germany,Europe,"Elso-Klöver-Str. 12, D-21337 Lüneburg, Deutschland undPlan 6, 20095 Hamburg, Deutschland",Mr Lars Droese,+49 4131 223667,+49 4131 223669,l.droese@holzkohlewerk.de ,,07.12.01,06.12.06,Packing and trading of charcoal and charcoal briquettes.
Kronospan GmbH Lampertswalde,SGS-COC-0703,Germany,Europe,"Muehlbacher Str. 1, 01561 Lampertswalde",Ms Christiane Oberbauer-Ott,49 3522-33-30,+49 3522-33-49049,c.oberbauer-ott@kronospan.de ,,22.05.01,22.05.06,Medium and High Density Fibre Boards from various hard and soft wood species and laminate products
Kronoflooring GmbH Lampertswalde,SGS-COC-0704,Germany,Europe,"Muehlbacher Str. 1, 01561 Lampertswalde",Mr Nikolaus Ebner,49 3522-33-30,+49 3522-33-49049,c.oberbauer-ott@kronospan.de ,,22.05.01,22.05.06,Medium and High Density Fibre Boards from various hard and soft wood species and laminate products
"Tapetenfabrik Coswig GmbH, Standort Coswig",SGS-COC-0725,Germany,Europe,"Industriestrasse 24/26, D-01640 Coswig",Ms I. Nestler,+ 49 3523 99 136,+ 49 3523 99 168,inestler@coswig-tapeten.de ,,06.06.01,06.06.06,Wallcoverings and borders from purchased raw paper
Varioboard GmbH,SGS-COC-0881,Germany,Europe,"Industriestrasse 7, 39126 Magdeburg","Mr Zens, Mr Schreiner",+49 (0)391-2423-131,+49 (0)391-2423-222,,,02.01.02,01.01.07,Manufacture of fibre boards containing a minimum of 30% certified fibre
Bockelmann Holz GmbH,SCS-COC-00391,Germany,Europe,"Elso-Klöver-Str. 3, D-21337 Lüneburg Deutschland",Herr Carsten Boedicker,+ 49 4131 87220 0,+ 49 4131 87220 11,c.boedicker@bockelmann-holz.de ,www.bockelmann-holz.de,23.01.02,23.01.07,Dealer of round logs from FSC endorsed certified forests.
Bremer Holz Hand Werk,GFA-COC-1058,Germany,Europe,"Stromer Landstraße 16c,28197 Bremen",Mr Ulrich u or Lachwa,+ 49 421 547805,+49 421 5289629,mail@bhhw.de ,,21.05.02,20.05.07,carpenter products all types
Forst Service Wirz,GFA-COC-1052,Germany,Europe,"An den Eichen 4, 53125 Bonn",Herr Wirz,-937279,-937280,forst.service.wirz@t-online.de ,,18.02.02,17.02.07,"timber trade (roundwood, sawn timber)"
Formschoen Fullservice Tischlerei Clemens Buck GmbH,SCS-COC-00524,Germany,Europe,Schoenstr. 89 81543 Muenchen,Mr. Clemens Buck,49 (0)89-7466 54-48,49 (0)89-7466 54-47,nicnet@t-online.de ,,31.03.03,31.03.08,"All joinery products. . Either 100% or a minimum percentage (as stated on on-product labels, invoices, and product descriptions) of the wood in or used in making the product lines is FSC-certified."
Witholz & Hilpert Säge- und Hobelwerk,IMO-COC-22090,Germany,Europe,"Ortsteil Witznau, D-79777 Ühldingen-Birkendorf",Mr. Schmiederer,-16900,-16920,witholz@aol.com ,www.witholz.de,25.04.02,31.12.04,wood chips
AS GmbH,IMO-COC-22084,Germany,Europe,"Postfach 1141, Finkenweg 1, D-91568 Bechhofen",Mr. Rainer ARNOLD,+49 9822 5894,+ 49 9822 900,Arnold-Ferrulemen@t-online.de ,,06.05.02,31.12.04,brush and broom sticks
Coronet - Werke GmbH,SGS-COC-0988,Germany,Europe,"Neustadt 2, D-69483 Wald-Michelbach,",Mr. Rueger,+49 6207 601 269,+49 6207 601 259,,,04.04.02,04.04.07,"coat-hangers, brooms and brushes"
Sägewerk Wagener GmbH,GFA-COC-1057,Germany,Europe,Bültenweg 2 59597 Erwitte-Schmerlecke Deutschland,Jürgen Wagener,-5117,-4453,saegewerk.wagner@t-online.de ,,18.02.02,17.02.07,"sawn wood and timber trade, planed and sawned products"
GLUNZ AG Werk Nettgau,IMO-COC-22132,Germany,Europe,"Strohmweg 1, D-38489 Nettgau-Gladdenstedt",Dr. Remme,+ 49 390 03 97508,+ 49 390 03 97333,Stefan.Remme@glunz.de ,,08.02.02,31.12.04,Particle- and OSB-boards
SWL Tischlerplatten Betriebs-GmbH,GFA-COC-1053,Germany,Europe,"Lippstädter Str.4, 33449 Langenberg",Herr F.J. Schonlau,-56118,-12110,m.ester@s-w-l.com ,www.s-w-l.com,18.02.02,17.02.07,"blockboards, veneered panels"
Schubecker Innenausbau - Ladenbau,GFA-COC-1034,Germany,Europe,Wetzlarer Strasse 55 35435 Wettenberg,Wolfgang Schubecker,+ 49 641 980 307,+ 49 641 980 309,,,06.09.01,06.09.06,interios + Ladenbau
Fa. MUES HOLZWARENFABRIK,GFA-COC-1051,Germany,Europe,Eikweg 14 59889 Eslohe-Reiste,Mr Mues,+49 (0)2973-3265,+49 (0)2973-3629,,,18.02.02,17.02.07,"clothes pegs, coat hangers, trouser hangers, and clips"
PIEPER HOLZ GmbH,GFA-COC-1050,Germany,Europe,"Im Westfeld 2, 59939 Olsberg-Assinghausen",Herr Pieper,+ 49 2962 9711 0,+ 49 2962 9711 31,hg.pieper@pieperholz.de ,www.pieperholz.de,18.02.02,17.02.07,"Sawn wood, wood used in gardens, wooden toys"
Witex AG,GFA-COC-1036,Germany,Europe,Nord-West-Ring 21 32832 Augustdorf,Mr Reißner,+49 (0) 5237-609 201,+49 (0) 5237-609 399,reissner@witex.com ,www.witex.com,08.01.02,07.01.07,"laminated and veneer flooring panels, cork parquet, FSC-certified products trade"
Schuhmann OHG,SGS-COC-0699,Germany,Europe,"Industriestrasse 34a, D-91207 Lauf/",Mr W. Schuhmann,-18839,-18894,,,22.05.01,22.05.06,"Paintbrush handles from beech, rubberwood and others"
Dieter Höltkemeyer Möbelfabrik GmbH & Co. KG,SGS-COC-0890,Germany,Europe,"Dammstrasse 45, D-32457 Porta Westfalica",Mr Michael Höltkemeyer,+ 49 57 31 7609 0,+ 49 57 31 7609 50,,,14.01.02,14.01.07,Furniture
Proholz Holzsortimente Handels GmbH / Proholz GmbH,SCS-COC-00432,Germany,Europe,"Am Kannenofen 20, 53721 Siegburg,",Karsten Lüghausen,-3254,-3262,K-Lueghausen@Lueghausen.de ,www.lueghausen.de,04.06.02,04.06.07,"The new product category is: Laminated boards, Shelves, Sawn wood, Plywood, and Small furniture that contains a minimum of 70% FSC certified material."
Landschaftsarchitekt Björn DIPPEL,GFA-COC-1056,Germany,Europe,"Steeg 10, 47804 Krefeld",Herr Björn Dippel,-757863,-760604,info@dippel-gartenarchitektur.de ,,19.02.02,18.02.07,outdoor planing and timber trade
Ahlstrom Osnabrück GmbH,SGS-COC-0105,Germany,Europe,"Römereschstrasse 33, Osnabrück, 49090",Mr. Ulrik Arneberg,+ 49 541 604 301,+ 49 541 604 226,www.ahlstrom.com,,04.03.98,02.06.08,Wallpaper
Sägewerks- und Holzhandels-GmbH,SGS-COC-1444,Germany,Europe,"Am Sägewerk 1, D-53925 Kall-Soetenich",Mr. K. W. Schumacher,+49 2441 4797,+49 2441 6090,,,11.07.03,10.07.08,Sawn wood
Dresden Papier AG,SGS-COC-0127,Germany,Europe,Pirnaer Str. 31 D-01809 Heidenau,Mr. Van der krukMr,49-(0) 3529 55 40,49 (0) 3529 55 41 80,,,17.04.03,17.04.08,"Production of Duplex raw paper, containing not more than 34% of recycled fibre and not less than 30% of certified fibre of its total fibre content"
ESPEN AG,SCS-COC-00001,Germany,Europe,"Im Rosengarten 1, D-61118 Bad Vilbel",Juergen Jordan and Jens Goebel,49 6101 9833-0,49 6101 9833-13,info@espen.de ,,13.03.98,05.02.08,"Logs, sawn timber and processed wood products; MDF-Boards. Either 100% or a minimum percentage (as stated on on-product labels, invoices, and product descriptions) of the wood in or used in making the product line or the collection of product is FSC-certified"
Inpa Parket,SCS-COC-00078,Germany,Europe,"Denis Roa 1290, Esquina Austria, Asuncion",Mr. Norbert Thielmann,49-40-390-5959,49-40-390-5957,inpa@pla.net.py. ,,01.04.98,01.10.08,Parquet flooring
Westeifel Werke gGmbH,SGS-COC-0160,Germany,Europe,"Vulkanring 7, 54568 Gerolstein",Mr. Marcus Fürstenberg,0049 6591 16 412,0049 6591 16 401,mfuerstenberg@westeifel-werke.de ,www.westeifel-werke.de,20.08.98,19.08.08,"“Purchase of sawn wood and garden furniture, production and refinement of wooden garden and park objects and items from tropical and European soft- and hardwoods.”"
Enno Roggemann GmbH & Co. KG.,SCS-COC-00106,Germany,Europe,"Ahrensstrasse 4, D-28197 Bremen,",Mr. Carl-Guenther Jastram,49-421-51850,49-421-518552,www.enno-roggemann-bremen.de,,01.01.99,01.07.04,Sawn timber and laminated scantlings
Merxx Handels GmbH,SCS-COC-00185,Germany,Europe,"Wilv-Brand-Allee 19, D-23554 Lübeck",Mr. Rainer Tiburzik,+ 49 451 707 990,+ 49 451 707 9922,zentral@merxx.de ,www.merxx.de,01.10.00,01.10.05,Importer and Wholesaler of Garden Furniture made of Teak Wood and Wood from Eucalyptus
Braun & Wetteberg GmbH,SGS-COC-0184,Germany,Europe,"Hirschhorner Str. 84-90, P:O Box 1260, D-64741 Beerfelden",Herr Gunter Krämer,+49 60 68 9309-0,+49 60 68 3028,,,14.08.01,20.10.03,Manufacture of fine brusches and various accessories from certified beech wood
W. Classen GmbH & Co. KG,SKAL-COC-013071,Germany,Europe,"Werner-von Siemenstreaße 18-20, 56759 Kaisersesch","Mr Marcus Peech, Mr Ruland",+ 49 265 398 00,+ 49 26 53 980 599,peech@classen.nl ,www.classen.de,01.01.01,31.12.04,"different kinds of boards and timber-products, laminated wood, Laminate"
Garpa Garten & Park Einrichtungen GmbH,SW-COC-128,Germany,Europe,"Kiehnwiese 1, 21039 Escheburg","Mr. Kai Udo EhlersGarten & Park Einrichtungen Gmbh Kiehnwiese 1, Escheburg bei Hamburg, 21039",49-41-5292-5200,04152-925250,kai.ehlers@t-online.de ,,01.10.98,31.12.08,"Furniture parts, furniture outdoor and garden"
Promex/Poliflor Sp. Zo. O,SCS-COC-00125,Germany,Europe,"Steinbrueckerstr. 2-4 , D-23556 Luebeck",Mr. Bendick,49-451-898-558,49-451-898-663,www.promex-online.de,,01.07.99,15.11.04,"Manufacturer and distributor sawn timber, mouldings, garden furniture, and decorative articles timber"
Emil LUX GmbH & Co KG,IMO-COC-9985,Germany,Europe,"E-Lux-Str. 1, D-42929 Wermelskirchen",Frau Britta Hellhammer,+ 49 2196 761 259,+ 49 2196 761 184,britta.hellhammer@emil-lux.de ,www.lux-tools.de,26.08.99,31.12.04,Tools
Chemviron Carbon GmbH,IMO-COC-9991,Germany,Europe,"Uslarer str. 30, D-37194 Bodenfelde",Mr. Maruschewski,+ 49 5572 944 0,+ 49 5572 944 131,maruschewski@calgoncarbon.de ,www.holzkohle.de,26.08.99,31.12.04,Charcoal
Sieger GmbH&Co,SCS-COC-00160,Germany,Europe,"Landstr. 14, D-77839 Lichtenau",Mr. Jürgen Reimert,+ 49 7227 509 145,+ 49 7227 509 173,www.sieger-gmbh.de,,01.02.00,01.02.05,Outdoor furniture
Bümag-Bürsten e.G,GFA-COC-1004,Germany,Europe,"Wiesenhäuser 1, 08328 Stützengrün",Frank Pawlowsky,+ 49 3 74 62 66 536,+ 49 3 74 62 66 515,F.Pawlowsky@buemag.de ,www.buemag.de,27.06.00,26.06.05,"Wooden brushes (all kinds), wooden shoe cleaner."
Interbros GmbH,SA-COC-1056,Germany,Europe,"Schwarzwaldstrasse 15, D-79674 Todnau",M Senger,49-7671-99513,49-7671-99589,Hj.Asal@interbros.de ,,10.12.99,10.12.04,Brushes
Fritz Buchheister OHG,SCS-COC-00151,Germany,Europe,"Selscheder Weg 4, D-59846 Sundern",Mr. Karl F. Buchheister,+49 2933 9762,+ 49 2933 9762 20,,,01.03.00,01.03.05,Round rods and finished curtain rods (contain at least 80% FSC endorsed material)
FiberMark Lahnstein GmbH & Co OHG,SGS-COC-0427,Germany,Europe,"Auf Brühl 15-27, 56112 Lahnstein",Ms Gerda Schreiber,+49 2621 177 674,+49 2621 177 679,,,09.03.00,09.03.05,"Various speciality paper from pulp and synthetic fibre, including Varitess® nonwoven for wallcoverings"
Holzindustrie Wennemen/Wilhelm Hüster KG,SGS-COC-0397,Germany,Europe,"Im Ruhrtal 60, Meschede",Wilhelm Hüster jr.,+ 49 29 03 9721 0,+ 49 2903 9721 19,,,13.01.00,13.01.05,Production of sawn wood products from hardwoods and trading with wood products for the lighting and furniture industry
Florin Holzwarenfabrik,IMO-COC-9830,Germany,Europe,"In der Odeborn 25, D-57319 Bad Berleburg-",Mr. A. Salewsky,+ 49 2758 228; 468,+ 49 2758 255,info@salewsky.de ,www.salewsky.de,03.06.98,31.12.04,Kitchen and house articles
Salewsky-Holzwaren,IMO-COC-9828,Germany,Europe,"Industriestrasse 17a, D-51702 Bergneustadt",Mr. A. Salewsky,-49945,-45725,info@salewsky.de ,www.salewsky.de,03.06.98,31.12.04,Kitchen and house articles
Erfurt & Sohn KG,SGS-COC-0431,Germany,Europe,"Wupperstr. 39, 42399 Wuppertal",Dr. Walter,+ 49 202 6110 263,+ 49 202 6110 391,,,14.08.01,15.03.05,Manufacture of wall coverings from certified raw non-woven and wall covering raw paper containing at least 30% certified fiber.
Siegbert Barg,GFA-COC-1002,Germany,Europe,"Osterweg 7, 32549 Bad Oeynhausen",Siegbert Barg,+ 49 5731 7521 88,+ 49 5731 7521 87,,,27.06.00,26.06.05,"furniture, stareways, windows, doors, parquet, wooden constuction elements"
Templin Holzindustrie,IMO-COC-9926,Germany,Europe,"Zehdenicker Str. 27, D-17268, Templin",Herr Würfel,+ 49 3987 7002 0,+ 49 3987 7002 99,holzindustrie.templin.gmbh@t-online.de ,,03.05.99,31.12.04,"sawn timber, boards, half finished parquet pales"
Sorpetaler Fensterbau,IMO-COC-9977,Germany,Europe,"Selbecke 6, D-59846, Sundern-Hagen",Mr. Norbert Appelhans,+ 49 2393 9192 0,+ 49 2393 9192 60,norbert@sorpetaler.de ,www.sorpetaler.de,12.08.99,31.12.04,"Wooden doors and windows, strips of wood, winter gardens"
Sonnholz Päckert + Laube,IMO-COC-9976,Germany,Europe,"Auf der Heide 3, D-99706 Sondershausen-Großfurra",Mr. H-J Laube,+ 49 3632 7118 0,+ 49 3632 7825 25,sonnholz@t-online.de ,www.sonnholz.de,02.08.99,31.12.04,Garden Furniture
Jorkisch Bernd GmbH & Co. KG,IMO-COC-9904,Germany,Europe,"Hoken 15-19, D-24635 Daldorf",Mr. Krahner,+ 49 4328 1780 0,+ 49 4328 178 238,info@jorkisch.de ,www.jorkisch.de,29.09.99,31.12.04,"round wood and sawn timber from conifers, garden articles"
Kurt Fischer Laubhölzer GmbH,IMO-COC-9927,Germany,Europe,"Bornhöveder Landstr. 4, D-24635 Daldorf",Mr. Ingo Fischer,+ 49 4328 430,+ 49 4328 1694,info@fischer-holz.de ,www.fischer.holz.de,03.05.99,31.12.04,round wood and sawn timber from broad-leaved trees
Becker und Hach GmbH & Co. KG Bilderrahmenfabrik,SCS-COC-00165,Germany,Europe,"Sonnenhügel 1, 37269 Eschwege",Teresa Murawska,+ 49 5651 8080,+ 49 5651 808 205,Teresa.Murawska@b-h-gallery.com ,www.b-h-gallery.com,01.04.00,01.04.05,"Wholesaler of picture frames with MDF or HDF backs. Either 100% or a minimum percentage (as stated on on-product labels, invoices, and product descriptions) of the wood in or used in the manufacturing process of these products is FSC-certified."
"Lukács-Vári, Mrs. E.",SKAL-COC-800678,Hungary,Europe,Nemeske u. 16/a H-1182 Budapest,"Lukács-Vári, Mrs. E.",0036-12902607,0036-12960372,,,09.10.03,31.12.04,Wooden toys Round timber
Halácsi Kft,SKAL-COC-801003,Hungary,Europe,Cserje sor 4 6728 SZEGED,"Halacsi, Mr. G. (Gabor)",+36 62 468 435,+36 62 484 703,halacsi@vnet.hu ,,29.04.04,29.04.09,Broom handles
Roussel European LLC,SKAL-COC-801486,Hungary,Europe,ERDERT Rt Tuzseri Fureszuzem Tuzsér 4623,Mr. N. Alakpepe,+36 45 541 110,+36 45 541 109,natty.tuzser@erdert.hu ,,23.04.04,22.04.09,Round timber
